Name,Description,Image URL
English Thyme,"This woody little evergreen plant spreads steadily over the years and has pretty pink flowers which bees love. English Thyme seeds plants grows to heights of 30cm (12""). Read More",//www.westcoastseeds.com/cdn/shop/products/HR1145-1_515x640_crop_center.jpg?v=1610654905
Ghost Chili,"At over one million Scoville Heat Units, the Ghost Chili is one of the world's hottest peppers. This pepper is so hot, in fact, that it should be treated with caution. We encourage very careful handling of the seeds and fruits. Read More",//www.westcoastseeds.com/cdn/shop/products/PP673-Ghost-Chili-Seeds_515x640_crop_center.jpg?v=1610656955
Centennial Broccoli,"Small beads on large, smooth heads with very tightly packed beads and very few side shoots. This remarkably versatile broccoli can be grown year round in cool coastal regions. Read More",//www.westcoastseeds.com/cdn/shop/products/BR186_Centennial-Broccoli_1_515x640_crop_center.jpg?v=1610586469
Showy Milkweed,"Native to western and central North America (including BC's Okanagan region), Showy Milkweed is the plant at the center of Monarch butterfly conservation efforts. This is the particular species of milkweed that the Monarch caterpillars feed on after hatching, so it is highly prized by egg-laying adults. Read More",//www.westcoastseeds.com/cdn/shop/products/FL3852-Showy-Milkweed_515x640_crop_center.jpg?v=1610579546
Sunrich Lime,"The flowers are very round with dense numbers of petals, but the flowers produce no pollen, so they won't make a mess when they're cut and brought indoors. They make really excellent, long-lasting cut flowers, with blooms 10-15cm (4-6"") across. Read More",//www.westcoastseeds.com/cdn/shop/products/FL3858-Sunrich-Lime_515x640_crop_center.jpg?v=1610585408
Jackpot,"When Jackpot zucchini starts producing, you'll think you hit the jackpot! Bushy plants have few spines, very high yield, and continuous production. Read More",//www.westcoastseeds.com/cdn/shop/products/Jackpot-Zucchini-Seeds-SQ759-1_515x640_crop_center.jpg?v=1610655641
Neon,"These beautifully shaped, bright orange pumpkins have strong, dark green handles and make perfect Jack-O-Lanterns. Read More",//www.westcoastseeds.com/cdn/shop/products/PU670-1_515x640_crop_center.jpg?v=1610578594
Midnight Blue,"Vivid navy blue flowers adorn this tiny, trailing Lobelia, making it ideal for stuffing between other plants as a ground cover. The flowers are highly attractive to bees and butterflies. Read More",//www.westcoastseeds.com/cdn/shop/products/FL2033-2_515x640_crop_center.jpg?v=1610657100
Hilda Romano,"Hilda Romano pole bean has flat pods, no strings, and great flavour. This bean is one of the first to produce in the summer and keeps going until frost if kept picked. Read More",//www.westcoastseeds.com/cdn/shop/products/BN172-Hilda-Romano-Pole-Bean-Seeds_515x640_crop_center.jpg?v=1610655312
Dwarf Green Curled,"Dwarf Green Curled kale seeds is an heirloom Scottish kale dating back to 1865, originally known as Dwarf Curlies. Plants are very compact, growing to only 30-45cm (12-18"") tall, but with delicate, succulent, tightly curled leaves. Read More",//www.westcoastseeds.com/cdn/shop/products/KL423_Dwarf-Green-Curled_seeds_11_515x640_crop_center.jpg?v=1610589621
Tango Coated Organic,"Improved breeding makes Tango the celery of choice for a wide range of growing conditions. Its stringless stalks have very little fibre, but have a high water content and keep a remarkably refined taste. Read More",//www.westcoastseeds.com/cdn/shop/products/CL347_Tango-celery_1_515x640_crop_center.jpg?v=1610656252
Swiss Giants Mix,"The classic heirloom Swiss Giants Mix Pansy seeds blend has single colours with blotched faces and some bicolours, with flowers held high above the leaves. Technically a perennial, this plant is usually grown as a cold hardy annual that will bloom in mild climates from October through to May from a late summer sowing. Read More",//www.westcoastseeds.com/cdn/shop/products/FL3026-1_515x640_crop_center.jpg?v=1610656662
Olympia,Olympia spinach seeds probably produce the best dark green plain leaf type for year round sowing and harvest. This fast growing spinach holds its leaves up off the ground and is an excellent choice for cooking and salads. Read More,//www.westcoastseeds.com/cdn/shop/products/SP703-1_515x640_crop_center.jpg?v=1610657032
Mashed Potatoes,"Slightly oblong acorn squashes grow on compact, semi-bush vines. The exterior skins are bright white, and hold their colour right into the fall. The interior flesh is also white and low in sugar. Read More",//www.westcoastseeds.com/cdn/shop/products/SQ804-Mashed-Potatoes-0X7A0686_515x640_crop_center.jpg?v=1610578844
Uchiki Red Kuri Organic,"This is a Japanese type Hubbard (red kuri), with dark, red/orange skin over tasty, cream coloured flesh. Popular in Japanese and Thai dishes, the flesh is flavourful and firm, and never stringy. Read More",//www.westcoastseeds.com/cdn/shop/products/SQ729_REDKURI1_25d92da9-6e3f-4402-84ed-4f27498f3721_515x640_crop_center.jpg?v=1678131635
Big Max,"Give Big Max pumpkin seeds a good early start indoors in May and transplant them out once the soil is warm in June. Provide deeply dug, very fertile soil, and you can expect very large Jack-o-Lantern type pumpkins up to 23kg (50 lbs) each! Read More",//www.westcoastseeds.com/cdn/shop/products/PU669-1_515x640_crop_center.jpg?v=1610651930
Tiny Tim,"Tiny Tim cherry tomato seeds are easy to grow and produce unique dwarf plants that work very well in small containers, window boxes, hanging baskets and small garden spaces. Read More",//www.westcoastseeds.com/cdn/shop/products/TM758-12_515x640_crop_center.jpg?v=1610577947
Dwarf Munstead,"This open plant is an early flowering selection with more blue in the flowers. Dwarf Munstead lavender seeds are the most aromatic of the English lavenders, giving off a sweet and delicate perfume. Read More",//www.westcoastseeds.com/cdn/shop/products/HR1096-Dwarf-Munstead-Lavender-Seeds_515x640_crop_center.jpg?v=1610588726
Grand Rapids TBR,"Grand Rapids TBR Looseleaf lettuce seeds produce a large, upright rosette of thick, juicy, light-green, frilly leaves and a blanched center. Read More",//www.westcoastseeds.com/cdn/shop/products/LT456-1_515x640_crop_center.jpg?v=1610580126
Goldy Organic,"Uniformly cylindrical along its whole length, and intensely yellow in colour. Goldy’s fruits average 20-25cm (8-10″) long. Plant Goldy Organic zucchini seeds for relatively small plants that are open and vigorous with hardly any spines. The fruits are tender and delicious. Read More",//www.westcoastseeds.com/cdn/shop/products/SQ712_-Goldy-0X7A4099_515x640_crop_center.jpg?v=1610656851
Rugby,"Rugby is a productive roma with firm, dense flesh that is smooth and soft in texture. They have superb, well-balanced flavour and... Read More",//www.westcoastseeds.com/cdn/shop/files/TM760ARugby2_Apr2023_V_Cropped_515x640_crop_center.jpg?v=1683231451
Royal Burgundy,"Round, stringless, dark purple pods grow 15cm (6”) long and are held off the ground by strong, upright plants. This high yielding variety is well suited to cooler soils. Read More",//www.westcoastseeds.com/cdn/shop/products/BN115-Royal-Burgundy-0X7A3979_515x640_crop_center.jpg?v=1610656644
Scarlet Emperor,"The large clusters of beautiful scarlet flowers and rapid, vigorous, sprawling growth make Scarlet Emperor an ideal choice for screens, trellises, and balconies. Read More",//www.westcoastseeds.com/cdn/shop/products/BN127-1_515x640_crop_center.jpg?v=1610656332
French Lavender,"Sow French lavender seeds indoors, 6-8 weeks before last frost, or direct sow the seeds in early spring when a chance of frost is still possible. Uniform and distinctive, 'Sancho Panza' blooms from June to September on shrubby bushes that grow 35cm (14"") tall. Read More",//www.westcoastseeds.com/cdn/shop/products/HR1093-1_515x640_crop_center.jpg?v=1610654371
Lemon Cupcake,"Each flower opens as a conventional looking Zinnia, but then ruffles from the centre with so many petals that it resembles the pincushion flower, Scabiosa. The truly handsome blooms top tall, upright stems that are superb as cut flowers. Read More",//www.westcoastseeds.com/cdn/shop/products/FL_Zinnia-Scabiosaflora-Yellow-0X7A4416_515x640_crop_center.jpg?v=1610588810
Sakura Organic,"The Sakura cherry tomato variety is equally well suited for unheated greenhouse and open field production. Matures early giving excellent early yields, of deliciously sweet fruit. Read More",//www.westcoastseeds.com/cdn/shop/products/TM823-12_515x640_crop_center.jpg?v=1610656109
Tumbler,"This is the true hanging basket tomato and a customer favourite for many years. Tuck some Lobelia, or fill with pansies in the pot for extra visual appeal, water well and fed every four to six weeks with a hanging basket fertilizer. Read More",//www.westcoastseeds.com/cdn/shop/products/TM791-11_515x640_crop_center.jpg?v=1610584360
Lace Blue,"The dainty umbels of powder blue/lilac blossoms bloom atop branching, upright stems of this lace flower. Plants have plentiful buds but few... Read More",//www.westcoastseeds.com/cdn/shop/files/FL4061Didiscus-LaceBlue_Sahin_09-22_WCS_6_515x640_crop_center.jpg?v=1707840116
Peredovik Organic,This heirloom cultivar produces the black oil seed used for making sunflower oil and is the very top choice for feeding birds. Plants average one big head with few side branches. Read More,//www.westcoastseeds.com/cdn/shop/products/FL3265-1_515x640_crop_center.jpg?v=1610656422
Anaheim,"The pendant, dark green fruits have thick walls that are excellent or roasting or smoking, and will mature to dark red if left on the plant. Much less hot than a Jalapeno at 100-500 SHUs. Read More",//www.westcoastseeds.com/cdn/shop/products/PP642_Anaheim-32134730_Mid_jpg_5a4e32a7-4fa2-444f-85a4-756a19e0cfe8_515x640_crop_center.jpg?v=1644018954
Heavenly Blue,"Heavenly Blue morning glory seeds produce short vines bearing copious, huge, intensely blue flowers that open each morning and then fade to pink before closing for good in the evening. Every day more flowers open from mid to late summer. Read More",//www.westcoastseeds.com/cdn/shop/products/FL2978_HEAVENLYBLUE4_515x640_crop_center.jpg?v=1610577336
Kuroshinju Edamame,"This early maturing soya bean’s seeds turn black when fully cooked and are rich in antioxidants. It has a silkier texture, and sweeter flavour than many other varieties. Read More",//www.westcoastseeds.com/cdn/shop/products/BN_Kuroshinyu-IMG_5894_515x640_crop_center.jpg?v=1610577482
Tyria Organic,"What a wonderful long English cucumber! The mildly sweet flesh is rarely bitter, and covered by lighly ribbed, but smooth and tender skin. Read More",//www.westcoastseeds.com/cdn/shop/products/CU415-Tyria-Organic-Cucumber-Seeds_515x640_crop_center.jpg?v=1610589095
Giganteus,"Inconspicuous Giganteus sunflower seeds produce absolutely huge plants in one short season. This is the giant among sunflowers, with towering stems up to 3.6m (12') tall, as thick as a man's leg. Read More",//www.westcoastseeds.com/cdn/shop/products/FL3275-3_515x640_crop_center.jpg?v=1610656913
Kitchen Basil Blend,"Kitchen Basil Blend seeds combines three unique basil varieties for utility in the kitchen. Genovese basil has big smooth green leaves, for use in pesto and pasta. Read More",//www.westcoastseeds.com/cdn/shop/products/HR1011-1_515x640_crop_center.jpg?v=1610577617
Resistafly F1,"This sweet, Nantes type carrot has a small core and a bright colour throughout the whole root. The 15cm (6"") roots have... Read More",//www.westcoastseeds.com/cdn/shop/products/CR320_Resistafly_Sep2022_TozerSeeds1_515x640_crop_center.jpg?v=1668119658
Super Fantastic,Super Fantastic tomato seeds produce hardy vigorous vines that adapt well to a variety of climates. Immensely popular and an excellent producer on the West Coast of British Columbia. Read More,//www.westcoastseeds.com/cdn/shop/products/TM759-Super-Fantastic_515x640_crop_center.jpg?v=1610584535
Taiyo Organic,"Taiyo Organic sunflower seeds are a Certified Organic Japanese variety with very large, single 20-30cm (8-12"") wide flowers on sturdy stems that grow to 1.8-2m (5-6') tall. Rich yellow petals surround Taiyo's dark chocolate centre. Read More",//www.westcoastseeds.com/cdn/shop/products/FL3264_Taiyo_certified_Organic_sunflower_seeds_1_515x640_crop_center.jpg?v=1610657102
Santo Monogerm,"Regular cilantro seeds, or coriander as they are sometimes called, are actually little nutlets containing more than one true seed. Monogerm seeds have been split by the grower for more precise seeding, either in trays or direct in the field. Read More",//www.westcoastseeds.com/cdn/shop/products/HR1075-1_515x640_crop_center.jpg?v=1610587422
Miners Lettuce Claytonia,"Harvest with scissors, just above the crown of the plant and it will grow back up to three times. Given some protection, it can be grown all winter. Read More",//www.westcoastseeds.com/cdn/shop/products/MS480-12_515x640_crop_center.jpg?v=1610656525
Five Spot,"This low growing member of the Borage family is native to the hills of California, but grows well in most temperate garden soils. It takes its name from the conspicuous five spots of its 2cm (1"") wide flowers, which have evolved to attract solitary bees. Read More",//www.westcoastseeds.com/cdn/shop/products/FL1216-Five-spot-Nemophila-maculata_515x640_crop_center.jpg?v=1610656719
Speckled Butterhead Organic,"The most delicate and beautiful leaf lettuce of all the varieties we carry, Speckled Butterhead has apple-green buttery leaves with bright red, uniform little speckles, not blotches. Read More",//www.westcoastseeds.com/cdn/shop/products/LT473-1_515x640_crop_center.jpg?v=1610577778
Stevia Organic,"The leaves of this amazing “sugar plant” have extracts said to be 300 times sweeter than sugar. Useful as a sweetener for diabetics and dieters, research has shown that Stevia has additional uses in treating blood pressure problems. Read More",//www.westcoastseeds.com/cdn/shop/products/HR1140-4_515x640_crop_center.jpg?v=1610579911
Carolina Gold F1,"Carolina Gold bears high yields of uniform, orange-gold beefsteaks that are firm, meaty and have few seeds. The large 280g (10oz), crack... Read More",//www.westcoastseeds.com/cdn/shop/files/ETHiRJ_8rwFBnQJ3NJ28Y68B3Cy92TUoy52prZr8KeN3pQ_515x640_crop_center.jpg?v=1698865941
Tah Tsai,"Tah Tsai pac choi seeds are a beautiful, easy-to-grow delight, the small, glossy, spoon-shaped, dark-green leaves with white stems grow in a perfect flat rosette. It adds rich colour, mild flavour, and nutrition to salads and stir-fries. Read More",//www.westcoastseeds.com/cdn/shop/products/Tah-Tsai-Pac-Choi-Seeds-MU533-1_515x640_crop_center.jpg?v=1610579692
New Zealand Spinach,"Tetragonia tetragonioides. New Zealand Spinach is not a true spinach, but a warm weather plant that provides copious amounts of leaves for salads and cooked greens. Start seeds inside 2-3 weeks before your last frost date or sow outside after all danger of frost has passed. Read More",//www.westcoastseeds.com/cdn/shop/products/SP710-1_515x640_crop_center.jpg?v=1610654521
Strike,"Plant Strike bush beans seeds for productive, upright plants with good disease resistance. The pods are round, medium green, slender, and stringless, coming in a concentrated set for easy harvesting. Read More",//www.westcoastseeds.com/cdn/shop/products/BN101-1_515x640_crop_center.jpg?v=1610577905
Superschmeltz,"This giant kohlrabi remains tender up to the largest sizes but must be spaced at least 30cm (12"") apart. Its large root system lets it grow well where water is limited. It handles winter weather well and can be harvested until April from a mid-summer planting. Read More",//www.westcoastseeds.com/cdn/shop/products/KH432-1_515x640_crop_center.jpg?v=1610587420
Mad Hatter,"This eye-catching variation on the Bishop's Cap pepper variety is a new, award winning hybrid with superior plant vigour and higher yield than its OP cousins. The flattened disc shaped pods of Mad Hatter provide a crisp and crunchy texture for snacking at the mature green or red stage. Read More",//www.westcoastseeds.com/cdn/shop/products/PP671-Mad-Hatter-2_515x640_crop_center.jpg?v=1610588287
Paris Market,"These small, orange, nearly spherical carrots about the width of a dollar coin. Paris Market are easy to grow, even in fairly heavy soils. Read More",//www.westcoastseeds.com/cdn/shop/products/CR305-1_515x640_crop_center.jpg?v=1610656491
Starbor,"These uniform, compact plants are the best kale choice for harvesting all in one go at 45cm (18"") tall. The dark blue-green leaves are very tasty, and appealingly curled, with short internodes - meaning they’re packed more tightly on the stem than other types. Read More",//www.westcoastseeds.com/cdn/shop/products/KL441_Starbor-Kale-Seeds_515x640_crop_center.jpg?v=1610656314
Red Ball,"Red Ball brussels sprout seeds produce plants with red foliage and sprouts, and the colour really improves in cold weather and after frost. Yields on this 1m (39"") tall variety are a bit lower, but the dark red sprouts are sweeter, and thought to be more nutritious. Read More",//www.westcoastseeds.com/cdn/shop/products/BS210-1_515x640_crop_center.jpg?v=1610654299
Chinese Forget-Me-Nots,"Simple, tiny, indigo blue flowers are massed in clusters on well behaved, bushy plants. Direct sow Chinese Forget-Me-Nots Cynoglossum amabile seeds in the fall or early spring, and the fast growing plants will put on a show very early in the season, blooming from April to June. Read More",//www.westcoastseeds.com/cdn/shop/products/FL2597-Cynoglossum-0X7A7044_515x640_crop_center.jpg?v=1610577320
Kale Storm Pelleted,"Kale Storm multi-seed pellets each contain up to four different kale varieties each. These pellets are perfect for planting in containers, or for simplifying planting in the garden row. Read More",//www.westcoastseeds.com/cdn/shop/products/KL446-Kale-Storm-0X7A8177_515x640_crop_center.jpg?v=1610587901
Crane Feather Queen,"Crane Feather Queen is an F1 hybrid kale bred specifically for use as a cut flower in winter bouquets and flower arrangements. Deeply cut, frilly leaves in silvery grey surround a rosette of interior leaves that become a deep, dark pink in response to cold weather. Read More",//www.westcoastseeds.com/cdn/shop/products/FL3862-Crane-Feather-Queen-3-stems_515x640_crop_center.jpg?v=1610577336
Sugar Buns,"Sugar Buns remains tender for a good two weeks on the plants, allowing for a long harvest window. This corn is delightfully tender with a rich, creamy sweetness packed in fourteen rows of tender, yellow kernels on a slim, 19cm (7"") ear. Read More",//www.westcoastseeds.com/cdn/shop/products/CN380-1_515x640_crop_center.jpg?v=1610656836
Tasti-Lee Coated,"This is a fantastic hybrid with three prized features. First, the flavour is sensational, balancing perfectly sweetness and acidity. Second, they contain up to 50% more of the antioxidant lycopene than most other tomatoes. Finally, they remain in very good eating condition for weeks after harvesting, giving them a longer shelf life than the rest. Read More",//www.westcoastseeds.com/cdn/shop/products/TM838-Tasti-Lee-single_515x640_crop_center.jpg?v=1610657138
Mexican Tarragon Certified Organic,"This cousin of the marigold is a heat loving plant that may survive as a perennial in Zone 8, but it’s just as well treated as a half-hardy annual. Start Mexican Tarragon seeds indoors and transplant the seedlings out in May. Read More",//www.westcoastseeds.com/cdn/shop/products/HR_Mexican-Tarragon-0X7A7275_515x640_crop_center.jpg?v=1571067630
Mizuna,"Mild and sweet enough for salads, the thin, light-green, feathery leaves are deeply-cut but not curled. Plants grow vigorously so thin to at least 20cm (8""). Cut the whole plant about an inch above the ground and it will re-grow or pick individual leaves. Read More",//www.westcoastseeds.com/cdn/shop/products/MU529-1_515x640_crop_center.jpg?v=1610655964
Komatsuna Green,"Often known as mustard spinach, its leaves are tender and mild. Komatsuna Green mustard seeds can be used as a cut-and-come-again crop at any stage of growth. Use steamed or stir-fried or in salads and soups. Read More",//www.westcoastseeds.com/cdn/shop/products/MU540-1_515x640_crop_center.jpg?v=1610588090
Aji Rico,Aji is a standard pepper throughout South America. One of the reasons it is not well known here is its slow growth and heat demands. Aji Rico really shows the best of what can be achieved through hybrid plant breeding. Read More,//www.westcoastseeds.com/cdn/shop/products/PP676-Aji-Rico-0X7A4434_515x640_crop_center.jpg?v=1610656801
Little Finger Certified Organic,"CERTIFIED ORGANIC. Slender, deep purple fruit with thin skin and mildly sweet flesh. The 15cm (6"") fruits have very few seeds... Read More",//www.westcoastseeds.com/cdn/shop/products/EG430_LittleFingers_Oct29_P_WCS_515x640_crop_center.jpg?v=1668121644
Kurinishiki Mini Kabocha,"The dark green (nearly black) skin of Kurinishiki Mini Kabocha is attractively striped with light green lines. The interior flesh is yellow/orange, sweet, and tasty, with a very appealing fragrance. Read More",//www.westcoastseeds.com/cdn/shop/products/SQ806-Kurinishiki-Mini-Kabocha-0X7A9226_515x640_crop_center.jpg?v=1610656099
Laurentian,Sow Laurentian rutabaga seeds in your organic vegetable garden. Bright purple skins cover the top two thirds of this globe-shaped rutabaga. Read More,//www.westcoastseeds.com/cdn/shop/products/Laurentian-Rutabaga-Seeds-RU692_515x640_crop_center.jpg?v=1610586503
Borlotti Drying Bean Seeds,"The long vines of this Italian heirloom will grow 20 feet tall if provided support. These produce masses of 15cm (6”) pods by late summer, each filled with good, firm cream coloured beans streaked with red. Read More",//www.westcoastseeds.com/cdn/shop/products/BN120_Borlotti_beans_1_515x640_crop_center.jpg?v=1610579169
Sorrento,"The flavour is very similar to broccoli, with a touch of bitterness that is surprisingly appealing. Broccoli raab is actually more closely related to turnips than broccoli, but is not grown as a root crop. Read More",//www.westcoastseeds.com/cdn/shop/products/BR193-1_515x640_crop_center.jpg?v=1610581618
Liquorice,This is the plant that produces the distinctive flavour found in confectioneries and candies world wide. Liquorice is an herbaceous perennial legume that is harvested for its roots. Read More,//www.westcoastseeds.com/cdn/shop/products/HR1182-Licorice-0X7A4536_515x640_crop_center.jpg?v=1610656466
Principe Borghese,"This Tuscan heirloom is one of the finest for sun-dried tomatoes. Try growing some in three to five gallon pots on the balcony, or up against the south facing wall of a house to maximize heat from the sun. Read More",//www.westcoastseeds.com/cdn/shop/products/Principe-Borghese-Tomato-Seeds-TM806-1_515x640_crop_center.jpg?v=1610656845
Calico Popcorn,"Grow your own popcorn! Tiny kernels dot these 15cm (6”), multi-coloured cobs in yellow, brown, white, purple, red, and blue. Use Calico Popcorn seeds for edible popping corn, or simply as ornaments to mark the harvest season in early fall. Read More",//www.westcoastseeds.com/cdn/shop/products/CN386_Calico-Popcorn_Seeds_2470_515x640_crop_center.jpg?v=1610586682
Kalibos,"Kalibos Cabbage seeds produce a spectacular, fresh-tasting, pointed cabbage with intense reddish-purple leaves and high sugar content. The interior is dense with a small, tender core. Read More",//www.westcoastseeds.com/cdn/shop/products/CB226_Kalibos_cabbage_seeds_1_515x640_crop_center.jpg?v=1610578358
Western Blue-Eyed Grass,"Although its leaves are low growing and grass-like, Western Blue-Eyed Grass is more closely related to an iris than members of the grass family. This perennial is a very useful ground cover for shadier areas, as it prefers partial shade. Read More",//www.westcoastseeds.com/cdn/shop/products/FL1205-WCS-Western-Blue-Eyed-Grass_515x640_crop_center.png?v=1614727445
Cassoulet,"Cassoulet drying bean seeds are grown for use in the French dish, cassoulet. Unusually thin skins cover delicate, low-starch beans with subtle, mild flavour. The compact, bushy plants are extremely productive, setting masses of pods, and flowering right through summer if kept picked. Read More",//www.westcoastseeds.com/cdn/shop/products/BN098_Tarbais_Bean_1_515x640_crop_center.jpg?v=1610656455
Bodacious,"Bodacious corn seeds are highly recommended for home grown corn on the cob or freezing, and it keeps its fine flavour and sweetness for several days after harvesting. The husk is an attractive dark-green colour and kernels are bright yellow and tender. Read More",//www.westcoastseeds.com/cdn/shop/products/CN382-1_515x640_crop_center.jpg?v=1610648779
Parade Coated Organic,"For an open pollinated variety, Parade shows remarkable uniformity, with little or no bulbing. Dark green, almost waxy leaves grow vigorously with white stalks that can be made longer by hilling up soil around them. Read More",//www.westcoastseeds.com/cdn/shop/products/ON574-1_515x640_crop_center.jpg?v=1610587756
Top Bunch 2.0,"At maturity the leaves can measure over 60cm (24"") from stem to tip, and they are held pointing upward, away from the soil. The petioles are long and substantial for easy bunching, and the plants are highly uniform in size and shape. Read More",//www.westcoastseeds.com/cdn/shop/products/CO351-Top-Bunch-F1-0X7A5845_515x640_crop_center.jpg?v=1610655826
Bush Baby Marrow,"The fruits grow to approximately three quarters the size of a standard varieties. These compact plants have an open habit. Fruits are able to set and ripen quickly. Grow marrow plants directly in growing bags, large pots or right in the garden bed. Read More",//www.westcoastseeds.com/cdn/shop/products/SQ721bush_baby_marrow_seeds_11_515x640_crop_center.jpg?v=1610652949
